{
  "meta": {
    "timestamp": "2025-11-10T16:55:40.405Z",
    "commit": "b27b280",
    "families": [
      "kinship",
      "ownership",
      "employment",
      "creation",
      "location",
      "temporal",
      "causation",
      "part_whole",
      "identity",
      "event",
      "communication",
      "power",
      "comparison",
      "emotional",
      "negation"
    ],
    "synthetic_size": 300,
    "canary_size": 0
  },
  "metrics": {
    "kinship": {
      "synthetic": {
        "precision": 0.10344827586206896,
        "recall": 0.375,
        "f1": 0.16216216216216217,
        "support": 8
      },
      "canary": {
        "precision": 0,
        "recall": 0,
        "f1": 0,
        "support": 0
      }
    },
    "ownership": {
      "synthetic": {
        "precision": 0,
        "recall": 0,
        "f1": 0,
        "support": 5
      },
      "canary": {
        "precision": 0,
        "recall": 0,
        "f1": 0,
        "support": 0
      }
    },
    "employment": {
      "synthetic": {
        "precision": 0,
        "recall": 0,
        "f1": 0,
        "support": 8
      },
      "canary": {
        "precision": 0,
        "recall": 0,
        "f1": 0,
        "support": 0
      }
    },
    "creation": {
      "synthetic": {
        "precision": 0,
        "recall": 0,
        "f1": 0,
        "support": 7
      },
      "canary": {
        "precision": 0,
        "recall": 0,
        "f1": 0,
        "support": 0
      }
    },
    "location": {
      "synthetic": {
        "precision": 0,
        "recall": 0,
        "f1": 0,
        "support": 10
      },
      "canary": {
        "precision": 0,
        "recall": 0,
        "f1": 0,
        "support": 0
      }
    },
    "temporal": {
      "synthetic": {
        "precision": 0,
        "recall": 0,
        "f1": 0,
        "support": 7
      },
      "canary": {
        "precision": 0,
        "recall": 0,
        "f1": 0,
        "support": 0
      }
    },
    "causation": {
      "synthetic": {
        "precision": 0,
        "recall": 0,
        "f1": 0,
        "support": 0
      },
      "canary": {
        "precision": 0,
        "recall": 0,
        "f1": 0,
        "support": 0
      }
    },
    "part_whole": {
      "synthetic": {
        "precision": 0,
        "recall": 0,
        "f1": 0,
        "support": 2
      },
      "canary": {
        "precision": 0,
        "recall": 0,
        "f1": 0,
        "support": 0
      }
    },
    "identity": {
      "synthetic": {
        "precision": 0,
        "recall": 0,
        "f1": 0,
        "support": 8
      },
      "canary": {
        "precision": 0,
        "recall": 0,
        "f1": 0,
        "support": 0
      }
    },
    "event": {
      "synthetic": {
        "precision": 0,
        "recall": 0,
        "f1": 0,
        "support": 10
      },
      "canary": {
        "precision": 0,
        "recall": 0,
        "f1": 0,
        "support": 0
      }
    },
    "communication": {
      "synthetic": {
        "precision": 0,
        "recall": 0,
        "f1": 0,
        "support": 10
      },
      "canary": {
        "precision": 0,
        "recall": 0,
        "f1": 0,
        "support": 0
      }
    },
    "power": {
      "synthetic": {
        "precision": 0,
        "recall": 0,
        "f1": 0,
        "support": 10
      },
      "canary": {
        "precision": 0,
        "recall": 0,
        "f1": 0,
        "support": 0
      }
    },
    "comparison": {
      "synthetic": {
        "precision": 0,
        "recall": 0,
        "f1": 0,
        "support": 5
      },
      "canary": {
        "precision": 0,
        "recall": 0,
        "f1": 0,
        "support": 0
      }
    },
    "emotional": {
      "synthetic": {
        "precision": 0,
        "recall": 0,
        "f1": 0,
        "support": 8
      },
      "canary": {
        "precision": 0,
        "recall": 0,
        "f1": 0,
        "support": 0
      }
    },
    "negation": {
      "synthetic": {
        "precision": 0,
        "recall": 0,
        "f1": 0,
        "support": 0
      },
      "canary": {
        "precision": 0,
        "recall": 0,
        "f1": 0,
        "support": 0
      }
    }
  },
  "counts": {
    "generated": {
      "kinship": 8,
      "ownership": 5,
      "employment": 8,
      "creation": 7,
      "location": 10,
      "temporal": 7,
      "causation": 0,
      "part_whole": 2,
      "identity": 8,
      "event": 10,
      "communication": 10,
      "power": 10,
      "comparison": 5,
      "emotional": 8,
      "negation": 0
    },
    "skipped_duplicates": {
      "kinship": 0,
      "ownership": 0,
      "employment": 0,
      "creation": 0,
      "location": 0,
      "temporal": 0,
      "causation": 0,
      "part_whole": 0,
      "identity": 0,
      "event": 0,
      "communication": 0,
      "power": 0,
      "comparison": 0,
      "emotional": 0,
      "negation": 0
    },
    "evaluated": {
      "kinship": 8,
      "ownership": 5,
      "employment": 8,
      "creation": 7,
      "location": 10,
      "temporal": 7,
      "causation": 0,
      "part_whole": 2,
      "identity": 8,
      "event": 10,
      "communication": 10,
      "power": 10,
      "comparison": 5,
      "emotional": 8,
      "negation": 0
    }
  },
  "errors": {
    "false_negatives": {
      "kinship": [
        {
          "text": "Prince Edward --[related_to]--> Queen Elizabeth",
          "pattern_id": "unknown",
          "reason": "Missed by extraction"
        },
        {
          "text": "Sofia --[related_to]--> Marcus",
          "pattern_id": "unknown",
          "reason": "Missed by extraction"
        },
        {
          "text": "King Arthur --[related_to]--> Uther Pendragon",
          "pattern_id": "unknown",
          "reason": "Missed by extraction"
        },
        {
          "text": "Isabella --[related_to]--> Ferdinand",
          "pattern_id": "unknown",
          "reason": "Missed by extraction"
        },
        {
          "text": "Catherine and --[related_to]--> William",
          "pattern_id": "unknown",
          "reason": "Missed by extraction"
        }
      ],
      "ownership": [
        {
          "text": "Rockefeller --[owns]--> Standard Oil Company",
          "pattern_id": "unknown",
          "reason": "Missed by extraction"
        },
        {
          "text": "The --[belongs_to]--> Duke of Westminster",
          "pattern_id": "unknown",
          "reason": "Missed by extraction"
        },
        {
          "text": "Tesla --[possesses]--> Solar",
          "pattern_id": "unknown",
          "reason": "Missed by extraction"
        },
        {
          "text": "The --[property_of]--> Louvre Museum",
          "pattern_id": "unknown",
          "reason": "Missed by extraction"
        },
        {
          "text": "Musk --[owns]--> Tesla and Space",
          "pattern_id": "unknown",
          "reason": "Missed by extraction"
        }
      ],
      "employment": [
        {
          "text": "Sarah --[works_for]--> Google",
          "pattern_id": "unknown",
          "reason": "Missed by extraction"
        },
        {
          "text": "Dr --[employed_by]--> Chen",
          "pattern_id": "unknown",
          "reason": "Missed by extraction"
        },
        {
          "text": "Marcus --[member_of]--> Board of Directors",
          "pattern_id": "unknown",
          "reason": "Missed by extraction"
        },
        {
          "text": "Elena --[affiliated_with]--> Chief Technology Officer",
          "pattern_id": "unknown",
          "reason": "Missed by extraction"
        },
        {
          "text": "Professor Smith --[affiliated_with]--> Harvard University",
          "pattern_id": "unknown",
          "reason": "Missed by extraction"
        }
      ],
      "creation": [
        {
          "text": "Leonardo da Vinci --[painted]--> Mona Lisa",
          "pattern_id": "unknown",
          "reason": "Missed by extraction"
        },
        {
          "text": "Shakespeare --[authored]--> Hamlet",
          "pattern_id": "unknown",
          "reason": "Missed by extraction"
        },
        {
          "text": "Mozart --[composed]--> The Magic Flute",
          "pattern_id": "unknown",
          "reason": "Missed by extraction"
        },
        {
          "text": "Tolkien --[created]--> The Lord of the Rings",
          "pattern_id": "unknown",
          "reason": "Missed by extraction"
        },
        {
          "text": "Picasso --[painted]--> Guernica",
          "pattern_id": "unknown",
          "reason": "Missed by extraction"
        }
      ],
      "location": [
        {
          "text": "Paris --[located_in]--> France",
          "pattern_id": "unknown",
          "reason": "Missed by extraction"
        },
        {
          "text": "The Eiffel Tower --[located_in]--> Paris",
          "pattern_id": "unknown",
          "reason": "Missed by extraction"
        },
        {
          "text": "Silicon Valley --[located_in]--> California",
          "pattern_id": "unknown",
          "reason": "Missed by extraction"
        },
        {
          "text": "The Pyramids --[located_in]--> Giza",
          "pattern_id": "unknown",
          "reason": "Missed by extraction"
        },
        {
          "text": "Harvard University --[located_in]--> Cambridge",
          "pattern_id": "unknown",
          "reason": "Missed by extraction"
        }
      ],
      "temporal": [
        {
          "text": "The Renaissance --[after]--> Middle Ages",
          "pattern_id": "unknown",
          "reason": "Missed by extraction"
        },
        {
          "text": "The French Revolution --[after]--> American Civil War",
          "pattern_id": "unknown",
          "reason": "Missed by extraction"
        },
        {
          "text": "The Industrial Revolution --[after]--> Medieval",
          "pattern_id": "unknown",
          "reason": "Missed by extraction"
        },
        {